{
  "$schema": "./concept-graph.schema.json",
  "version": "2026-10-04.2",
  "source": "docs/curriculum/02-concept-graph.md, 03-line1-mvp-map.md; 성취기준 코드는 docs/CURRICULUM.md(별책 8 원문 대조)",
  "rules": {
    "prereqDefault": "mastered",
    "minLevelNote": "minLevel이 있으면 그 노드를 그 단계까지 풀 수 있으면 충족. 개통(mastered)은 3단계 이상에서 판정하므로 minLevel ≤ 3 조건은 개통으로 자동 충족된다.",
    "masteryLevel": 3,
    "levelsWithinCommentary": [
      1,
      6
    ]
  },
  "lines": {
    "DEPOT": {
      "name": "정비창 곁가지 선로",
      "stations": null
    },
    "L1": {
      "name": "1호선",
      "domain": "수와 연산",
      "stations": [
        "다대포해수욕장",
        "다대포항",
        "낫개",
        "신장림",
        "장림",
        "동매",
        "신평",
        "하단",
        "당리",
        "사하",
        "괴정",
        "대티",
        "서대신",
        "동대신",
        "토성",
        "자갈치",
        "남포",
        "중앙",
        "부산역",
        "초량",
        "부산진",
        "좌천",
        "범일",
        "범내골",
        "서면",
        "부전",
        "양정",
        "시청",
        "연산",
        "교대",
        "동래",
        "명륜",
        "온천장",
        "부산대",
        "장전",
        "구서",
        "두실",
        "남산",
        "범어사",
        "노포"
      ]
    },
    "L2": {
      "name": "2호선",
      "domain": "도형과 측정",
      "stations": null,
      "stationCount": 43,
      "note": "추천 순서는 서면에서 시작해 양산 방향(3~4학년), 그다음 서면에서 장산 방향(5~6학년). 시범 구간: 서면·부암·가야·동의대·개금 (docs/curriculum/10-line2-pilot.md)"
    },
    "L3": {
      "name": "3호선",
      "domain": "변화와 관계",
      "stations": null,
      "stationCount": 17
    },
    "L4": {
      "name": "4호선",
      "domain": "자료와 가능성",
      "stations": null,
      "stationCount": 14
    },
    "DH": {
      "name": "동해선",
      "domain": "경시",
      "stations": null,
      "stationCount": 23
    }
  },
  "nodes": [
    {
      "id": "B01",
      "title": "0과 100까지의 수",
      "codes": [
        "2수01-01"
      ],
      "gradeBand": "1-2",
      "line": "DEPOT",
      "order": 1,
      "station": null,
      "strand": "foundation",
      "prereqs": [],
      "ceiling": 3,
      "scope": "in"
    },
    {
      "id": "B02",
      "title": "네 자리 이하의 자릿값",
      "codes": [
        "2수01-02"
      ],
      "gradeBand": "1-2",
      "line": "DEPOT",
      "order": 2,
      "station": null,
      "strand": "foundation",
      "prereqs": [
        {
          "node": "B01"
        }
      ],
      "ceiling": 3,
      "scope": "in"
    },
    {
      "id": "B03",
      "title": "네 자리 이하 수의 계열·크기 비교",
      "codes": [
        "2수01-03"
      ],
      "gradeBand": "1-2",
      "line": "DEPOT",
      "order": 3,
      "station": null,
      "strand": "foundation",
      "prereqs": [
        {
          "node": "B02"
        }
      ],
      "ceiling": 3,
      "scope": "in"
    },
    {
      "id": "B04",
      "title": "수 가르기와 모으기",
      "codes": [
        "2수01-04"
      ],
      "gradeBand": "1-2",
      "line": "DEPOT",
      "order": 4,
      "station": null,
      "strand": "foundation",
      "prereqs": [
        {
          "node": "B01"
        }
      ],
      "ceiling": 3,
      "scope": "in"
    },
    {
      "id": "B05",
      "title": "덧셈·뺄셈의 의미",
      "codes": [
        "2수01-05"
      ],
      "gradeBand": "1-2",
      "line": "DEPOT",
      "order": 5,
      "station": null,
      "strand": "foundation",
      "prereqs": [
        {
          "node": "B04"
        }
      ],
      "ceiling": 3,
      "scope": "in"
    },
    {
      "id": "B06",
      "title": "두 자리 수 덧셈·뺄셈",
      "codes": [
        "2수01-06"
      ],
      "gradeBand": "1-2",
      "line": "DEPOT",
      "order": 6,
      "station": null,
      "strand": "foundation",
      "prereqs": [
        {
          "node": "B05"
        },
        {
          "node": "B02"
        }
      ],
      "ceiling": 3,
      "scope": "in"
    },
    {
      "id": "B07",
      "title": "덧셈과 뺄셈의 관계",
      "codes": [
        "2수01-07"
      ],
      "gradeBand": "1-2",
      "line": "DEPOT",
      "order": 7,
      "station": null,
      "strand": "foundation",
      "prereqs": [
        {
          "node": "B06"
        }
      ],
      "ceiling": 3,
      "scope": "in"
    },
    {
      "id": "B08",
      "title": "두 자리 범위의 세 수 덧셈·뺄셈",
      "codes": [
        "2수01-08"
      ],
      "gradeBand": "1-2",
      "line": "DEPOT",
      "order": 8,
      "station": null,
      "strand": "foundation",
      "prereqs": [
        {
          "node": "B06"
        }
      ],
      "ceiling": 3,
      "scope": "in"
    },
    {
      "id": "B09",
      "title": "□가 있는 덧셈식·뺄셈식",
      "codes": [
        "2수01-09"
      ],
      "gradeBand": "1-2",
      "line": "DEPOT",
      "order": 9,
      "station": null,
      "strand": "foundation",
      "prereqs": [
        {
          "node": "B07"
        }
      ],
      "ceiling": 3,
      "scope": "in"
    },
    {
      "id": "B10",
      "title": "곱셈의 의미",
      "codes": [
        "2수01-10"
      ],
      "gradeBand": "1-2",
      "line": "DEPOT",
      "order": 10,
      "station": null,
      "strand": "foundation",
      "prereqs": [
        {
          "node": "B05"
        }
      ],
      "ceiling": 3,
      "scope": "in"
    },
    {
      "id": "B11",
      "title": "곱셈구구",
      "codes": [
        "2수01-11"
      ],
      "gradeBand": "1-2",
      "line": "DEPOT",
      "order": 11,
      "station": null,
      "strand": "foundation",
      "prereqs": [
        {
          "node": "B10"
        }
      ],
      "ceiling": 3,
      "scope": "in"
    },
    {
      "id": "N01",
      "title": "세 자리 수의 덧셈",
      "codes": [
        "4수01-03"
      ],
      "gradeBand": "3-4",
      "line": "L1",
      "order": 1,
      "station": "다대포해수욕장",
      "strand": "whole",
      "prereqs": [
        {
          "node": "B06"
        },
        {
          "node": "B02"
        }
      ],
      "ceiling": 6,
      "scope": "in"
    },
    {
      "id": "N02",
      "title": "세 자리 수의 뺄셈(받아내림 한 번)",
      "codes": [
        "4수01-03"
      ],
      "gradeBand": "3-4",
      "line": "L1",
      "order": 2,
      "station": "다대포항",
      "strand": "whole",
      "prereqs": [
        {
          "node": "B06"
        },
        {
          "node": "B07"
        }
      ],
      "ceiling": 6,
      "scope": "in"
    },
    {
      "id": "N03",
      "title": "받아내림 여러 번·0이 있는 뺄셈",
      "codes": [
        "4수01-03"
      ],
      "gradeBand": "3-4",
      "line": "L1",
      "order": 3,
      "station": "낫개",
      "strand": "whole",
      "prereqs": [
        {
          "node": "N02"
        },
        {
          "node": "N01"
        }
      ],
      "ceiling": 6,
      "scope": "in"
    },
    {
      "id": "N04",
      "title": "덧셈·뺄셈 어림셈과 검산, 세 수의 계산",
      "codes": [
        "4수01-08"
      ],
      "gradeBand": "3-4",
      "line": "L1",
      "order": 4,
      "station": "신장림",
      "strand": "whole",
      "prereqs": [
        {
          "node": "N01"
        },
        {
          "node": "N03"
        },
        {
          "node": "B08"
        }
      ],
      "ceiling": 7,
      "scope": "in"
    },
    {
      "id": "N05",
      "title": "나눗셈의 의미",
      "codes": [
        "4수01-05"
      ],
      "gradeBand": "3-4",
      "line": "L1",
      "order": 5,
      "station": "장림",
      "strand": "whole",
      "prereqs": [
        {
          "node": "B11"
        }
      ],
      "ceiling": 5,
      "scope": "in"
    },
    {
      "id": "N06",
      "title": "곱셈과 나눗셈의 관계",
      "codes": [
        "4수01-05"
      ],
      "gradeBand": "3-4",
      "line": "L1",
      "order": 6,
      "station": "동매",
      "strand": "whole",
      "prereqs": [
        {
          "node": "N05"
        }
      ],
      "ceiling": 6,
      "scope": "in"
    },
    {
      "id": "N07",
      "title": "(두 자리)×(한 자리)",
      "codes": [
        "4수01-04"
      ],
      "gradeBand": "3-4",
      "line": "L1",
      "order": 7,
      "station": "신평",
      "strand": "whole",
      "prereqs": [
        {
          "node": "B11"
        },
        {
          "node": "B02"
        }
      ],
      "ceiling": 6,
      "scope": "in"
    },
    {
      "id": "N08",
      "title": "양의 등분할로 분수 이해",
      "codes": [
        "4수01-09"
      ],
      "gradeBand": "3-4",
      "line": "L1",
      "order": 8,
      "station": "하단",
      "strand": "fraction",
      "prereqs": [
        {
          "node": "N05"
        }
      ],
      "ceiling": 6,
      "scope": "in"
    },
    {
      "id": "N09",
      "title": "단위분수·분모가 같은 분수의 크기 비교",
      "codes": [
        "4수01-11"
      ],
      "gradeBand": "3-4",
      "line": "L1",
      "order": 9,
      "station": "당리",
      "strand": "fraction",
      "prereqs": [
        {
          "node": "N08"
        }
      ],
      "ceiling": 6,
      "scope": "in"
    },
    {
      "id": "N10",
      "title": "분모가 10인 분수와 소수 한 자리",
      "codes": [
        "4수01-12"
      ],
      "gradeBand": "3-4",
      "line": "L1",
      "order": 10,
      "station": "사하",
      "strand": "decimal",
      "prereqs": [
        {
          "node": "N08"
        }
      ],
      "ceiling": 6,
      "scope": "in"
    },
    {
      "id": "N11",
      "title": "소수 한 자리의 크기 비교",
      "codes": [
        "4수01-14"
      ],
      "gradeBand": "3-4",
      "line": "L1",
      "order": 11,
      "station": "괴정",
      "strand": "decimal",
      "prereqs": [
        {
          "node": "N10"
        }
      ],
      "ceiling": 5,
      "scope": "in"
    },
    {
      "id": "N12",
      "title": "(세 자리)×(한 자리)",
      "codes": [
        "4수01-04"
      ],
      "gradeBand": "3-4",
      "line": "L1",
      "order": 12,
      "station": "대티",
      "strand": "whole",
      "prereqs": [
        {
          "node": "N07"
        }
      ],
      "ceiling": 6,
      "scope": "in"
    },
    {
      "id": "N13",
      "title": "(두 자리)×(두 자리)",
      "codes": [
        "4수01-04"
      ],
      "gradeBand": "3-4",
      "line": "L1",
      "order": 13,